<?xml version="1.0" encoding="utf-8"?>

<xs:schema xmlns:xsi="http://www.w3.org/2001/XMLSchema-instance" attributeFormDefault="unqualified" elementFormDefault="qualified" xmlns:xs="http://www.w3.org/2001/XMLSchema">
    <xs:element name="freelance">
        <xs:complexType>
            <xs:sequence>
                <xs:element maxOccurs="unbounded" name="freelancer">
                    <xs:complexType>
                        <xs:sequence>
                            <xs:element name="name" minOccurs="1" maxOccurs="1">
                                <xs:simpleType>
                                    <xs:restriction base="xs:string">
                                        <xs:maxLength value="100"/>
                                    </xs:restriction>
                                </xs:simpleType>
                            </xs:element>
                            <xs:element name="id" type="xs:unsignedInt" />
                            <xs:element name="contact">
                                <xs:complexType>
                                    <xs:sequence>
                                        <xs:element name="email" type="xs:string" />
                                        <xs:element name="phone"    >
                                            <xs:simpleType>
                                        <xs:restriction base = "xs:integer">
                                            <xs:pattern value = "[0-9]{10}"/>
                                        </xs:restriction>
                                            </xs:simpleType>
                                        </xs:element>
                                    </xs:sequence>
                                </xs:complexType>
                            </xs:element>
                            <xs:element name="work">
                                <xs:complexType>
                                    <xs:sequence>
                                        <xs:element name="portfolio" type="xs:string" />
                                        <xs:element name="review" type="xs:string" />
                                    </xs:sequence>
                                </xs:complexType>
                            </xs:element>
                        </xs:sequence>
                    </xs:complexType>
                </xs:element>
            </xs:sequence>
        </xs:complexType>
    </xs:element>
</xs:schema>